{
  "antetSatirlari": ["T.C.", "YEŞİLVADİ BELEDİYE BAŞKANLIĞI", "Destek Hizmetleri Müdürlüğü"],
  "evrakSayisi": "68493012-902.03-3456",
  "dosyaKonusu": "Bütçe ve Ödenek Sorgusu",
  "tarih": "06/05/2026",
  "muhatapBirim": "MALİ HİZMETLER MÜDÜRLÜĞÜNE",
  "kurumAdi": "YEŞİLVADİ BELEDİYE BAŞKANLIĞI",
  "isAdi": "Belediyemiz park ve bahçelerinde kullanılmak üzere 150 adet dekoratif aydınlatma direği ve armatür alımı",
  "hazirlayanPersonelAdi": "Gökhan TEKİN",
  "hazirlayanPersonelUnvan": "Teknisyen",
  "butceYili": "2026",
  "butceTertibi": ["46.70.03.01.02.05-03.2.9.90"],
  "kullanilabilirOdenek": "185.000,00",
  "solLogo": "https://raw.githubusercontent.com/ilyasbozdemir/workdesk-360/main/public/icon.png",
  "sagLogo": "https://upload.wikimedia.org/wikipedia/commons/0/0f/Logo_of_100th_years_of_the_Republic_of_T%C3%BCrkiye.svg"
}
